{
  "schemaVersion": "1.0",
  "status": "READ_ONLY_PROVENANCE_CAPTURED / NOT_ADMITTED / RESOURCE_HOLD",
  "generatedAt": "2026-07-20T20:21:28Z",
  "baseline": {
    "repository": "/Users/sirinx/SIRINXDev/sirinx-co",
    "branch": "agent/b1-b2-command-center",
    "headSha": "1f05814c3e9d173e525234d69b3ce7f2d1b01a57",
    "workingTree": "DIRTY_USER_OWNED_CANDIDATE",
    "cargoLockPath": "Cargo.lock",
    "cargoLockSha256": "b1f0cddffa71d8189a7e40a87a169d98eb407a2da39b2b21d1ddfece8473185b",
    "host": "Mac14,3",
    "memoryGiB": 8,
    "logicalCpuCount": 8,
    "resourceReceipt": {
      "capturedAt": "2026-07-20T20:21:28Z",
      "volumePath": "/System/Volumes/Data",
      "freeDiskKiB": 14007668,
      "workloadFloorKiB": 15728640,
      "state": "HOLD_BELOW_15_GIB"
    }
  },
  "parentCatalog": {
    "catalogPath": "config/agent-runtime/external-components.research-only.v1.json",
    "catalogSha256": "2c796db789c919c630ef425387ed75a0cba94a98886cd40299195e47451482ec",
    "schemaPath": "schemas/agent-runtime/external-component-intake.v1.schema.json",
    "schemaSha256": "64127fbcb2595f606060c2fb627c2af414e1a18779d4c14d2bb50f271256d5eb",
    "validatorPath": "scripts/validate-external-component-intake.mjs",
    "validatorSha256": "0ff1ed446deb0258a7a0931042d55cefea7eae632674e2161dd6e743f4ba7dd6"
  },
  "authority": {
    "approvalSource": "APPROVE_IMPLEMENTATION_LOCAL_CODE_AND_DOCS_ONLY",
    "installGrantPresent": false,
    "connectorGrantPresent": false,
    "providerGrantPresent": false,
    "localInferenceGrantPresent": false,
    "cloudflareMutationGrantPresent": false,
    "liveSendGrantPresent": false
  },
  "protectedReadBoundary": [
    ".env files",
    "/Users/sirinx/.hermes/auth.json",
    "/Users/sirinx/.hermes/config.yaml",
    "browser profiles, cookies, and keychains"
  ],
  "components": [
    {
      "id": "openai-codex-cli",
      "category": "AGENT_HARNESS",
      "catalogDisposition": "RECONCILE_EXISTING",
      "status": "LOCAL_EVIDENCE_CAPTURED_NOT_ADMITTED",
      "classification": "ARTIFACT_IDENTIFIED_NOT_UPSTREAM_BOUND",
      "selectedRevision": "0.144.6 / 0.144.6-darwin-arm64",
      "localIdentity": "PATH-first npm layout plus a distinct ChatGPT-app embedded Codex binary",
      "artifacts": [
        {
          "role": "command-link",
          "path": "/Users/sirinx/.local/bin/codex",
          "canonicalPath": "/Users/sirinx/.local/lib/node_modules/@openai/codex/bin/codex.js",
          "pathKind": "SYMLINK_TO_REGULAR_FILE",
          "linkTarget": "../lib/node_modules/@openai/codex/bin/codex.js",
          "sizeBytes": 7236,
          "modeOctal": "755",
          "sha256": "134063e133f0b4244fa3b251acf973d4fe4b4aeeacbdc135211bf480f59f1477",
          "verification": "FULL_FILE_SHA256"
        },
        {
          "role": "package-manifest",
          "path": "/Users/sirinx/.local/lib/node_modules/@openai/codex/package.json",
          "canonicalPath": "/Users/sirinx/.local/lib/node_modules/@openai/codex/package.json",
          "pathKind": "REGULAR_FILE",
          "linkTarget": null,
          "sizeBytes": 1082,
          "modeOctal": "644",
          "sha256": "b701b7d7b7683263e5612e612c468c526d78c3deb1360741e976dc40e0456919",
          "verification": "FULL_FILE_SHA256"
        },
        {
          "role": "platform-package-manifest",
          "path": "/Users/sirinx/.local/lib/node_modules/@openai/codex/node_modules/@openai/codex-darwin-arm64/package.json",
          "canonicalPath": "/Users/sirinx/.local/lib/node_modules/@openai/codex/node_modules/@openai/codex-darwin-arm64/package.json",
          "pathKind": "REGULAR_FILE",
          "linkTarget": null,
          "sizeBytes": 517,
          "modeOctal": "644",
          "sha256": "051cbc20f48e7bd20b89e301ffc8f60af890a1da3815e5e700f11ada41c3b445",
          "verification": "FULL_FILE_SHA256"
        },
        {
          "role": "native-binary",
          "path": "/Users/sirinx/.local/lib/node_modules/@openai/codex/node_modules/@openai/codex-darwin-arm64/vendor/aarch64-apple-darwin/bin/codex",
          "canonicalPath": "/Users/sirinx/.local/lib/node_modules/@openai/codex/node_modules/@openai/codex-darwin-arm64/vendor/aarch64-apple-darwin/bin/codex",
          "pathKind": "REGULAR_FILE",
          "linkTarget": null,
          "sizeBytes": 260472144,
          "modeOctal": "755",
          "sha256": "80a3933d11a9d13ef806aa24f7bb8afc9169cfe4e9b09d6da6a92922cbde9cff",
          "verification": "FULL_FILE_SHA256"
        },
        {
          "role": "chatgpt-embedded-alternate",
          "path": "/Applications/ChatGPT.app/Contents/Resources/codex",
          "canonicalPath": "/Applications/ChatGPT.app/Contents/Resources/codex",
          "pathKind": "REGULAR_FILE",
          "linkTarget": null,
          "sizeBytes": 264898656,
          "modeOctal": "755",
          "sha256": "f0b214b476e04175bee104fe441caea874baeef3efc3828bfb79e972266156a9",
          "verification": "FULL_FILE_SHA256"
        }
      ],
      "packageRecords": [],
      "observations": [
        "Package metadata declares @openai/codex 0.144.6 and platform package 0.144.6-darwin-arm64.",
        "The two native binaries are distinct byte artifacts; the ChatGPT application version is not treated as an embedded CLI version.",
        "Code-signature inspection reported OpenAI TeamIdentifier 2DC432GLL2 for both native binaries."
      ],
      "unresolvedGaps": [
        "No global npm lock/integrity receipt or exact install transaction was present.",
        "No reproducible source-to-binary proof binds the local bytes to the upstream release.",
        "The embedded ChatGPT Codex CLI version remains unasserted."
      ],
      "claims": {
        "upstreamIdentityBound": false,
        "installReceiptVerified": false,
        "reproducibleBuildVerified": false,
        "runtimeVerified": false,
        "admitted": false,
        "canInstall": false,
        "canRun": false,
        "canConnect": false
      }
    },
    {
      "id": "nous-hermes-agent",
      "category": "AGENT_HARNESS",
      "catalogDisposition": "RECONCILE_EXISTING",
      "status": "LOCAL_EVIDENCE_CAPTURED_NOT_ADMITTED",
      "classification": "EDITABLE_SOURCE_UNPINNED",
      "selectedRevision": "0.18.2 editable@299e409f15aa5615a8a64be488580be92cda351e-dirty",
      "localIdentity": "Local shell wrapper to a uv-managed editable Python environment",
      "artifacts": [
        {
          "role": "command-wrapper",
          "path": "/Users/sirinx/.local/bin/hermes",
          "canonicalPath": "/Users/sirinx/.local/bin/hermes",
          "pathKind": "REGULAR_FILE",
          "linkTarget": null,
          "sizeBytes": 117,
          "modeOctal": "755",
          "sha256": "ea0fbb0f5519c2bd1727e0f4433e88e2ff59be88da6135318af479213533bc49",
          "verification": "FULL_FILE_SHA256"
        },
        {
          "role": "python-entrypoint",
          "path": "/Users/sirinx/.hermes/hermes-agent/venv/bin/hermes",
          "canonicalPath": "/Users/sirinx/.hermes/hermes-agent/venv/bin/hermes",
          "pathKind": "REGULAR_FILE",
          "linkTarget": null,
          "sizeBytes": 332,
          "modeOctal": "755",
          "sha256": "774f2a3981451eb52cc7bac3e1eb2463a59d1567e3e5acda539b80d8a02c5372",
          "verification": "FULL_FILE_SHA256"
        },
        {
          "role": "distribution-metadata",
          "path": "/Users/sirinx/.hermes/hermes-agent/venv/lib/python3.12/site-packages/hermes_agent-0.18.2.dist-info/METADATA",
          "canonicalPath": "/Users/sirinx/.hermes/hermes-agent/venv/lib/python3.12/site-packages/hermes_agent-0.18.2.dist-info/METADATA",
          "pathKind": "REGULAR_FILE",
          "linkTarget": null,
          "sizeBytes": 24950,
          "modeOctal": "644",
          "sha256": "de2dc10a2bca961fff227bf808641a18a27e1d8349e4796a841b9e96433e12d4",
          "verification": "FULL_FILE_SHA256"
        },
        {
          "role": "editable-source-receipt",
          "path": "/Users/sirinx/.hermes/hermes-agent/venv/lib/python3.12/site-packages/hermes_agent-0.18.2.dist-info/direct_url.json",
          "canonicalPath": "/Users/sirinx/.hermes/hermes-agent/venv/lib/python3.12/site-packages/hermes_agent-0.18.2.dist-info/direct_url.json",
          "pathKind": "REGULAR_FILE",
          "linkTarget": null,
          "sizeBytes": 80,
          "modeOctal": "644",
          "sha256": "857d9e3a52a6446428dee180a2b61a5e07e8f38d14e33e68bdc80bec8b1b00c0",
          "verification": "FULL_FILE_SHA256"
        },
        {
          "role": "distribution-record",
          "path": "/Users/sirinx/.hermes/hermes-agent/venv/lib/python3.12/site-packages/hermes_agent-0.18.2.dist-info/RECORD",
          "canonicalPath": "/Users/sirinx/.hermes/hermes-agent/venv/lib/python3.12/site-packages/hermes_agent-0.18.2.dist-info/RECORD",
          "pathKind": "REGULAR_FILE",
          "linkTarget": null,
          "sizeBytes": 1436,
          "modeOctal": "644",
          "sha256": "8ea366c4a2f75182933247c317ecf5b7992f68d076ea8d1df3f0dc8cfeb97e33",
          "verification": "FULL_FILE_SHA256"
        },
        {
          "role": "editable-entry-module",
          "path": "/Users/sirinx/.hermes/hermes-agent/hermes_cli/main.py",
          "canonicalPath": "/Users/sirinx/.hermes/hermes-agent/hermes_cli/main.py",
          "pathKind": "REGULAR_FILE",
          "linkTarget": null,
          "sizeBytes": 623008,
          "modeOctal": "644",
          "sha256": "7696883c8339be7eb51da78a6a7431f58252921ab1bb5d26d53e12fbec5c3be8",
          "verification": "FULL_FILE_SHA256"
        }
      ],
      "packageRecords": [],
      "observations": [
        "Distribution metadata reports hermes-agent 0.18.2, installer uv, and an editable file URL under /Users/sirinx/.hermes/hermes-agent.",
        "Local Git observation reported HEAD 299e409f15aa5615a8a64be488580be92cda351e and a dirty editable worktree behind the cached origin/main by 147 commits.",